{
  "schema": "specnav.verification.repair-review.v1",
  "id": "repair-review-case-03-spec-approved",
  "kind": "spec-review",
  "verdict": "approved",
  "reviewer_id": "wenliang_zeng-spec-review",
  "reviewer_kind": "human",
  "reviewed_at": "2026-08-09T06:46:03Z",
  "evidence_id": "case-03-spec-review-evidence",
  "task_id": "900-verification-repair-2119e2b03a127fe1",
  "failure_id": "failure-8722e64d98596a82cdd1d3c01bb597e4d6a1003e7d17ac1b7a0497c5d410ff12",
  "repair_link_id": "repair-9b57e83fd69222e42be653ab1556914749bbab94eab309b6a14c5c8f36f26df7",
  "repair_link_digest": "c053792455972585b23f340ab7dc3b0a4784cd51fe78ec3664d9c6d61be5cf09",
  "scope_digest": "9708a4f1c41fe11cce2166a42da7a7624d8c649417d50796a75ee62e1f788ffd",
  "after_identity_digest": "e75bff82f60cb606b60ea6df82e005146f48a4d1eebf5239f9630656f9378f9f"
}
